{
  "version": "seed-0.0.1",
  "profile": "ja-L2-adult",
  "clusterCount": 87,
  "clusters": [
    {
      "learnerProfile": "ja-L2-adult",
      "domain": "Writing System & Orthography",
      "ageRangeStart": null,
      "ageRangeEnd": null,
      "gradeRangeStart": null,
      "gradeRangeEnd": null,
      "levelRangeStart": "A1.0",
      "levelRangeEnd": "A1.1",
      "summary": "Adult beginners learn kana as a compact entry point into Japanese sounds, spelling, dictionary use, and textbook examples."
    },
    {
      "learnerProfile": "ja-L2-adult",
      "domain": "Phonology & Listening",
      "ageRangeStart": null,
      "ageRangeEnd": null,
      "gradeRangeStart": null,
      "gradeRangeEnd": null,
      "levelRangeStart": "A1.0",
      "levelRangeEnd": "A1.2",
      "summary": "Adult beginners need explicit attention to mora rhythm because it contrasts with many learners' first-language timing systems."
    },
    {
      "learnerProfile": "ja-L2-adult",
      "domain": "Particles & Information Structure",
      "ageRangeStart": null,
      "ageRangeEnd": null,
      "gradeRangeStart": null,
      "gradeRangeEnd": null,
      "levelRangeStart": "A1.0",
      "levelRangeEnd": "A1.5",
      "summary": "The L2 graph introduces particles early because adult learners need explicit form-function mappings for topic, location, existence, and objects."
    },
    {
      "learnerProfile": "ja-L2-adult",
      "domain": "Speaking & Interaction",
      "ageRangeStart": null,
      "ageRangeEnd": null,
      "gradeRangeStart": null,
      "gradeRangeEnd": null,
      "levelRangeStart": "A1.0",
      "levelRangeEnd": "A2.0",
      "summary": "Adult beginners learn high-utility questions and repair expressions so they can keep basic interactions going before their grammar is broad."
    },
    {
      "learnerProfile": "ja-L2-adult",
      "domain": "Syntax & Clause Combining",
      "ageRangeStart": null,
      "ageRangeEnd": null,
      "gradeRangeStart": null,
      "gradeRangeEnd": null,
      "levelRangeStart": "A1.1",
      "levelRangeEnd": "A1.3",
      "summary": "Early noun modification with の gives learners a reusable pattern for possession, affiliation, and simple description."
    },
    {
      "learnerProfile": "ja-L2-adult",
      "domain": "Morphology & Conjugation",
      "ageRangeStart": null,
      "ageRangeEnd": null,
      "gradeRangeStart": null,
      "gradeRangeEnd": null,
      "levelRangeStart": "A1.3",
      "levelRangeEnd": "A2.2",
      "summary": "Adult L2 grammar makes verb and adjective forms explicit so learners can produce tense, polarity, and て-form constructions intentionally."
    },
    {
      "learnerProfile": "ja-L2-adult",
      "domain": "Pragmatics & Sociolinguistics",
      "ageRangeStart": null,
      "ageRangeEnd": null,
      "gradeRangeStart": null,
      "gradeRangeEnd": null,
      "levelRangeStart": "A2.0",
      "levelRangeEnd": "A2.3",
      "summary": "Requests and other formulaic expressions are placed by communicative need and politeness, not only by grammatical complexity."
    },
    {
      "learnerProfile": "ja-L2-adult",
      "domain": "Business Communication & Workplace Japanese",
      "ageRangeStart": null,
      "ageRangeEnd": null,
      "gradeRangeStart": null,
      "gradeRangeEnd": null,
      "levelRangeStart": "B1.0",
      "levelRangeEnd": "C1.5",
      "summary": "The BJT strand extends adult L2 Japanese into workplace performance: business register, email, phone messages, meetings, reports, negotiation, proposals, and Japanese business customs."
    },
    {
      "learnerProfile": "ja-L2-adult",
      "domain": "Reading Comprehension",
      "ageRangeStart": null,
      "ageRangeEnd": null,
      "gradeRangeStart": null,
      "gradeRangeEnd": null,
      "levelRangeStart": "B1.5",
      "levelRangeEnd": "B2.5",
      "summary": "Business reading focuses on extracting required actions, deadlines, constraints, and responsible parties from internal documents, notices, and emails."
    },
    {
      "learnerProfile": "ja-L2-adult",
      "domain": "Intercultural Communication",
      "ageRangeStart": null,
      "ageRangeEnd": null,
      "gradeRangeStart": null,
      "gradeRangeEnd": null,
      "levelRangeStart": "B2.0",
      "levelRangeEnd": "C1.5",
      "summary": "Advanced workplace communication requires interpreting implicit expectations, hierarchy, timing, indirectness, and business customs rather than only literal grammar."
    },
    {
      "learnerProfile": "ja-L2-adult",
      "domain": "Reading Comprehension",
      "ageRangeStart": null,
      "ageRangeEnd": null,
      "gradeRangeStart": null,
      "gradeRangeEnd": null,
      "levelRangeStart": "A2.0",
      "levelRangeEnd": "B1.0",
      "summary": "N5-N4 reading focuses on extracting action, time, place, relationship, and constraints from short everyday messages, notices, and schedules."
    },
    {
      "learnerProfile": "ja-L2-adult",
      "domain": "Vocabulary & Semantics",
      "ageRangeStart": null,
      "ageRangeEnd": null,
      "gradeRangeStart": null,
      "gradeRangeEnd": null,
      "levelRangeStart": "C1.0",
      "levelRangeEnd": "C1.8",
      "summary": "JLPT N1 vocabulary work includes abstract compounds, nominalisations, academic/public-discourse words, and context-sensitive precision."
    },
    {
      "learnerProfile": "ja-L2-adult",
      "domain": "Reading Comprehension",
      "ageRangeStart": null,
      "ageRangeEnd": null,
      "gradeRangeStart": null,
      "gradeRangeEnd": null,
      "levelRangeStart": "B1.0",
      "levelRangeEnd": "C2.0",
      "summary": "Advanced JLPT reading moves from N3 medium-length narratives to N2 public-information synthesis and N1 policy, academic, and critical argument."
    },
    {
      "learnerProfile": "ja-L2-adult",
      "domain": "Pragmatics & Sociolinguistics",
      "ageRangeStart": null,
      "ageRangeEnd": null,
      "gradeRangeStart": null,
      "gradeRangeEnd": null,
      "levelRangeStart": "B2.0",
      "levelRangeEnd": "C2.0",
      "summary": "Advanced JLPT pragmatics requires interpreting modality, stance, formal speech register, rhetoric, hedging, and implied evaluation."
    },
    {
      "learnerProfile": "ja-L2-adult",
      "domain": "Learning Strategies & Meta-Language",
      "ageRangeStart": null,
      "ageRangeEnd": null,
      "gradeRangeStart": null,
      "gradeRangeEnd": null,
      "levelRangeStart": "A1.0",
      "levelRangeEnd": "C1.5",
      "summary": "Adult L2 learners benefit from explicit meta-language, reference use, notebooking, error diagnosis, and performance reflection because they are building Japanese through instructed study rather than child immersion."
    },
    {
      "learnerProfile": "ja-L2-adult",
      "domain": "Particles & Information Structure",
      "ageRangeStart": null,
      "ageRangeEnd": null,
      "gradeRangeStart": null,
      "gradeRangeEnd": null,
      "levelRangeStart": "A1.3",
      "levelRangeEnd": "A2.0",
      "summary": "N5 particle expansion covers addition, listing, time, endpoints, event location, means, tools, and richer daily-life information structure."
    },
    {
      "learnerProfile": "ja-L2-adult",
      "domain": "Morphology & Conjugation",
      "ageRangeStart": null,
      "ageRangeEnd": null,
      "gradeRangeStart": null,
      "gradeRangeEnd": null,
      "levelRangeStart": "A2.1",
      "levelRangeEnd": "B1.3",
      "summary": "N4 morphology extends te-form work into te iru, plain forms, nai, ta-form experience, and potential forms."
    },
    {
      "learnerProfile": "ja-L2-adult",
      "domain": "Syntax & Clause Combining",
      "ageRangeStart": null,
      "ageRangeEnd": null,
      "gradeRangeStart": null,
      "gradeRangeEnd": null,
      "levelRangeStart": "A2.2",
      "levelRangeEnd": "B1.0",
      "summary": "N4 clause combining introduces action sequence, noun-modifying clauses, reasons, explanation, and comparison."
    },
    {
      "learnerProfile": "ja-L2-adult",
      "domain": "Business Communication & Workplace Japanese",
      "ageRangeStart": null,
      "ageRangeEnd": null,
      "gradeRangeStart": null,
      "gradeRangeEnd": null,
      "levelRangeStart": "A2.0",
      "levelRangeEnd": "C2.0",
      "summary": "BJT workplace communication now spans routine status updates, delivery/order confirmation, table explanation, meeting synthesis, requirements, tradeoffs, negotiation, executive briefing, and senior Q&A."
    },
    {
      "learnerProfile": "ja-L2-adult",
      "domain": "Writing Composition",
      "ageRangeStart": null,
      "ageRangeEnd": null,
      "gradeRangeStart": null,
      "gradeRangeEnd": null,
      "levelRangeStart": "B1.0",
      "levelRangeEnd": "C1.8",
      "summary": "Business writing grows from email confirmation to approval requests, proposal documents, and executive summaries with recommendations."
    },
    {
      "learnerProfile": "ja-L2-adult",
      "domain": "Speaking & Interaction",
      "ageRangeStart": null,
      "ageRangeEnd": null,
      "gradeRangeStart": null,
      "gradeRangeEnd": null,
      "levelRangeStart": "A2.0",
      "levelRangeEnd": "B1.8",
      "summary": "Workplace interaction develops through confirmation, appointment scheduling, phone transfers, and client-facing clarification."
    },
    {
      "learnerProfile": "ja-L2-adult",
      "domain": "Intercultural Communication",
      "ageRangeStart": null,
      "ageRangeEnd": null,
      "gradeRangeStart": null,
      "gradeRangeEnd": null,
      "levelRangeStart": "B2.0",
      "levelRangeEnd": "C1.8",
      "summary": "Advanced BJT intercultural communication includes implicit expectations, escalation, stakeholder management, timing, hierarchy, and relationship repair."
    },
    {
      "learnerProfile": "ja-L2-adult",
      "domain": "Morphology & Conjugation",
      "ageRangeStart": null,
      "ageRangeEnd": null,
      "gradeRangeStart": null,